user_input,retrieved_contexts,response,reference,faithfulness,answer_relevancy,context_precision
"According to Morningstar, by how much did the average equity fund investor underperform the funds they invested in per year?","['were more volatile, or were subject to just as much\ndownside risk” as the hands-oﬀ fund.\nIndividual investors fall for this when making their own\ninvestments, too. The average equity fund investor\nunderperformed the funds they invested in by half a percent\nper year, according to Morningstar—the result of buying and\nselling when they should have just bought and held.⁵¹\nThe irony is that by trying to avoid the price, investors end\nup paying double.\nBack to GE. One of its many faults stems from an era under\nformer CEO Jack Welch. Welch became famous for ensuring\nquarterly earnings per share beat Wall Street estimates. He\nwas the grandmaster. If Wall Street analysts expected $0.25\nper share, Jack would deliver $0.26 no matter the state of\nbusiness or the economy. He’d do that by massaging the\nnumbers—that description is charitable—often pulling gains\nfrom future quarters into the current quarter to make the\nobedient numbers salute their master.\nForbes reported one of dozens of examples: “[General', 'buying and selling in a single day. Investors—particularly the\nones setting prices—were not thinking about the next 20\nyears. The average mutual fund had 120% annual turnover\nin 1999, meaning they were, at most, thinking about the\nnext eight months. So were the individual investors who\nbought those mutual funds. Maggie Mahar wrote in her book\nBull!:\n\xa0\nBy the mid-nineties, the press had replaced annual\nscorecards with reports that appeared every three months.\nThe change spurred investors to chase performance, rushing\nto buy the funds at the top of the charts, just when they\nwere most expensive.', 'the longevity he maintained in his geriatric years.\nHis skill is investing, but his secret is time.\nThat’s how compounding works.\nThink of this another way. Buﬀett is the richest investor of all\ntime. But he’s not actually the greatest—at least not when\nmeasured by average annual returns.\nJim Simons, head of the hedge fund Renaissance\nTechnologies, has compounded money at 66% annually\nsince 1988. No one comes close to this record. As we just\nsaw, Buﬀett has compounded at roughly 22% annually, a\nthird as much.\nSimons’ net worth, as I write, is $21 billion. He is—and I\nknow how ridiculous this sounds given the numbers we’re\ndealing with—75% less rich than Buﬀett.\nWhy the diﬀerence, if Simons is such a better investor?\nBecause Simons did not ﬁnd his investment stride until he\nwas 50 years old. He’s had less than half as many years to\ncompound as Buﬀett. If James Simons had earned his 66%\nannual returns for the 70-year span Buﬀett has built his\nwealth he would be worth—please hold your breath—sixty-', 'mutual funds, whose strategy is to switch between stocks\nand bonds at opportune times, capturing market returns\nwith lower downside risk.⁵⁰ They want the returns without\npaying the price. The study focused on the mid-2010\nthrough late 2011 period, when U.S. stock markets went\nwild on fears of a new recession and the S&P 500 declined\nmore than 20%. This is the exact kind of environment the\ntactical funds are supposed to work in. It was their moment\nto shine.\nThere were, by Morningstar’s count, 112 tactical mutual\nfunds during this period. Only nine had better risk-adjusted\nreturns than a simple 60/40 stock-bond fund. Less than a\nquarter of the tactical funds had smaller maximum\ndrawdowns than the leave-it-alone index. Morningstar\nwrote: “With a few exceptions, [tactical funds] gained less,', 'explained why he also owns a smattering of individual\nstocks: “I’m not buying individual stocks because I think I’m\ngoing to generate alpha [outperformance]. I just love stocks\nand have ever since I was 20 years old. And it’s my money, I\nget to do whatever.” Quite reasonable.\nMost forecasts about where the economy and the stock\nmarket are heading next are terrible, but making forecasts is\nreasonable. It’s hard to wake up in the morning telling\nyourself you have no clue what the future holds, even if it’s\ntrue. Acting on investment forecasts is dangerous. But I get\nwhy people try to predict what will happen next year. It’s\nhuman nature. It’s reasonable.\nJack Bogle, the late founder of Vanguard, spent his career on\na crusade to promote low-cost passive index investing. Many\nthought it interesting that his son found a career as an\nactive, high-fee hedge fund and mutual fund manager.\nBogle—the man who said high-fee funds violate “the']","According to Morningstar, the average equity fund investor underperformed the funds they invested in by half a percent per year.",half a percent per year,1.0,0.9722040134359552,
What is the proposed title for the most powerful and important book?,"['And that, to me, is as fascinating as it is important.\nMoney is everywhere, it aﬀects all of us, and confuses most of us. Everyone thinks about it alittle diﬀerently. It oﬀers lessons on things that apply to many areas of life, like risk,conﬁdence, and happiness. Few topics oﬀer a more powerful magnifying glass that helpsexplain why people behave the way they do than money. It is one of the greatest shows onEarth.\nMy own appreciation for the psychology of money is shaped by more than a decade ofwriting on the topic. I began writing about ﬁnance in early 2008. It was the dawn of aﬁnancial crisis and the worst recession in 80 years.\nTo write about what was happening, I wanted to ﬁgure out what was happening. But theﬁrst thing I learned after the ﬁnancial crisis was that no one could accurately explain whathappened, or why it happened, let alone what should be done about it. For every goodexplanation there was an equally convincing rebuttal.', 'What you’re holding is 20 chapters, each describing what I consider to be the mostimportant and often counterintuitive features of the psychology of money. The chaptersrevolve around a common theme, but exist on their own and can be read independently.\nIt’s not a long book. You’re welcome. Most readers don’t ﬁnish the books they beginbecause most single topics don’t require 300 pages of explanation. I’d rather make 20 shortpoints you ﬁnish than one long one you give up on.\nOn we go.', 'through other means. Not because we’re overthinking, but\nbecause we rarely stop to consider compounding potential.\nNone of the 2,000 books picking apart Buﬀett’s success are\ntitled This Guy Has Been Investing Consistently for Three-\nQuarters of a Century. But we know that’s the key to the\nmajority of his success. It’s just hard to wrap your head\naround that math because it’s not intuitive.\nThere are books on economic cycles, trading strategies, and\nsector bets. But the most powerful and important book\nshould be called Shut Up And Wait. It’s just one page with a\nlong-term chart of economic growth.\nThe practical takeaway is that the counterintuitiveness of\ncompounding may be responsible for the majority of\ndisappointing trades, bad strategies, and successful\ninvesting attempts.', 'you for something that is unimportant to you, it just does\nnot make any sense.\n\xa0\nThere is no reason to risk what you have and need for what\nyou don’t have and don’t need.\nIt’s one of those things that’s as obvious as it is overlooked.\nFew of us will ever have $100 million, as Gupta or Madoﬀ\ndid. But a measurable percentage of those reading this book\nwill, at some point in their life, earn a salary or have a sum', 'conservatively invested. To each their own. But the\nfoundation of, “does this help me sleep at night?” is\nthe best universal guidepost for all ﬁnancial\ndecisions.\nIf you want to do better as an investor, the single\nmost powerful thing you can do is increase your time\nhorizon. Time is the most powerful force in\ninvesting. It makes little things grow big and big\nmistakes fade away. It can’t neutralize luck and risk,\nbut it pushes results closer towards what people\ndeserve.\nBecome OK with a lot of things going wrong. You can\nbe wrong half the time and still make a fortune,\nbecause a small minority of things account for the\nmajority of outcomes. No matter what you’re doing\nwith your money you should be comfortable with a\nlot of stuﬀ not working. That’s just how the world is.\nSo you should always measure how you’ve done by\nlooking at your full portfolio, rather than individual\ninvestments. It is ﬁne to have a large chunk of poor\ninvestments and a few outstanding ones. That’s']","The proposed title for the most powerful and important book is ""Shut Up And Wait.""",Shut Up And Wait.,1.0,1.0,
"According to the text, how many planets in our galaxy are known to have intelligent life?","['“It’s not whether you’re right or wrong that’s important,”\nGeorge Soros once said, “but how much money you make when\nyou’re right and how much you lose when you’re wrong.” You\ncan be wrong half the time and still make a fortune.\n\xa0\n\xa0\nThere are 100 billion planets in our galaxy and only one, as far\nas we know, with intelligent life.\nThe fact that you are reading this book is the result of the\nlongest tail you can imagine.\nThat’s something to be happy about. Next, let’s look at how\nmoney can make you even happier.', 'NASA’s New Horizons spacecraft passed by Pluto two years\nago. It was a three-billion mile trip that took nine and a half\nyears. According to NASA, the trip “took about one minute\nless than predicted when the craft was launched in January\n2006.”⁶⁸\nThink about that. In an untested, decade-long journey,\nNASA’s forecast was 99.99998% accurate. That’s like\nforecasting a trip from New York to Boston and being\naccurate to within four millionths of a second.\nBut astrophysics is a ﬁeld of precession. It isn’t impacted by\nthe vagaries of human behavior and emotions, like ﬁnance\nis. Business, economics, and investing, are ﬁelds of\nuncertainty, overwhelmingly driven by decisions that can’t', 'I have seen none.\nThrough collective trial and error over the years we learned how to become better farmers,skilled plumbers, and advanced chemists. But has trial and error taught us to becomebetter with our personal ﬁnances? Are we less likely to bury ourselves in debt? More likelyto save for a rainy day? Prepare for retirement? Have realistic views about what moneydoes, and doesn’t do, to our happiness?\nI’ve seen no compelling evidence.\nMost of the reason why, I believe, is that we think about and are taught about money inways that are too much like physics (with rules and laws) and not enough like psychology(with emotions and nuance).\nAnd that, to me, is as fascinating as it is important.', '“I’m smart” is increasingly a bad answer to that question,\nbecause there are a lot of smart people in the world. Almost\n600 people ace the SATs each year. Another 7,000 come\nwithin a handful of points. In a winner-take-all and\nglobalized world these kinds of people are increasingly your\ndirect competitors.\nIntelligence is not a reliable advantage in a world that’s\nbecome as connected as ours has.\nBut ﬂexibility is.\nIn a world where intelligence is hyper-competitive and many\nprevious technical skills have become automated,\ncompetitive advantages tilt toward nuanced and soft skills—\nlike communication, empathy, and, perhaps most of all,\nﬂexibility.', '1. The more you want something to be true, the\nmore likely you are to believe a story that\noverestimates the odds of it being true.\n\xa0\nWhat was the happiest day of your life?\nThe documentary How to Live Forever asks that innocent\nquestion to a centenarian who oﬀered an amazing response.\n“Armistice Day,” she said, referring to the 1918 agreement\nthat ended World War I.\n“Why?” the producer asks.\n“Because we knew there would be no more wars ever\nagain,” she says.\nWorld War II began 21 years later, killing 75 million people.\nThere are many things in life that we think are true because\nwe desperately want them to be true.\nI call these things “appealing ﬁctions.” They have a big\nimpact on how we think about money—particularly\ninvestments and the economy.\nAn appealing ﬁction happens when you are smart, you want\nto ﬁnd solutions, but face a combination of limited control\nand high stakes.\nThey are extremely powerful. They can make you believe\njust about anything.\nTake a short example.']","According to the text, only one planet in our galaxy, as far as we know, has intelligent life.","only one, as far as we know, with intelligent life.",1.0,,
"What idea in finance, described as innocent, has caused incalculable damage?","['because no one wants to think they own an overvalued\nasset. In hindsight we’re more likely to point cynical ﬁngers\nthan to learn lessons.\nI don’t think we’ll ever be able to fully explain why bubbles\noccur. It’s like asking why wars occur—there are almost\nalways several reasons, many of them conﬂicting, all of\nthem controversial.\nIt’s too complicated a subject for simple answers.\nBut let me propose one reason they happen that both goes\noverlooked and applies to you personally: Investors often\ninnocently take cues from other investors who are playing a\ndiﬀerent game than they are.\n\xa0\n\xa0\nAn idea exists in ﬁnance that seems innocent but has done\nincalculable damage.\nIt’s the notion that assets have one rational price in a world\nwhere investors have diﬀerent goals and time horizons.\nAsk yourself: How much should you pay for Google stock\ntoday?\nThe answer depends on who “you” are.\nDo you have a 30-year time horizon? Then the smart price to\npay involves a sober analysis of Google’s discounted cash', 'reckless decisions and happened to get lucky. Both ﬂipped\nthe same coin that happened to land on a diﬀerent side.\nThe dangerous part of this is that we’re all trying to learn\nabout what works and what doesn’t with money.\nWhat investing strategies work? Which ones don’t?\nWhat business strategies work? Which ones don’t?\nHow do you get rich? How do you avoid being poor?\nWe tend to seek out these lessons by observing successes\nand failures and saying, “Do what she did, avoid what he\ndid.”\nIf we had a magic wand we would ﬁnd out exactly what\nproportion of these outcomes were caused by actions that\nare repeatable, versus the role of random risk and luck that\nswayed those actions one way or the other. But we don’t\nhave a magic wand. We have brains that prefer easy', 'Money has many ironies. Here’s an important one: Wealth is\nwhat you don’t see.\nMy time as a valet was in the mid-2000s in Los Angeles,\nwhen material appearance took precedence over everything\nbut oxygen.\nIf you see a Ferrari driving around, you might intuitively\nassume the owner of the car is rich—even if you’re not\npaying much attention to them. But as I got to know some\nof these people I realized that wasn’t always the case. Many\nwere mediocre successes who spent a huge percentage of\ntheir paycheck on a car.\nI remember a fellow we’ll call Roger. He was about my age. I\nhad no idea what Roger did. But he drove a Porsche, which\nwas enough for people to draw assumptions.\nThen one day Roger arrived in an old Honda. Same the next\nweek, and the next.\n“What happened to your Porsche?” I asked. It was\nrepossessed after defaulting on his car loan, he said. There\nwas not a morsel of shame. He responded like he was telling\nthe next play in the game. Every assumption you might have', 'wipeout: Not only were they left broke, but being wiped out\nerased every opportunity to get back in the game at the very\nmoment opportunity was ripe. A homeowner wiped out in\n2009 had no chance of taking advantage of cheap mortgage\nrates in 2010. Lehman Brothers had no chance of investing\nin cheap debt in 2009. They were done.\nTo get around this, I think of my own money as barbelled. I\ntake risks with one portion and am terriﬁed with the other.\nThis is not inconsistent, but the psychology of money would\nlead you to believe that it is. I just want to ensure I can\nremain standing long enough for my risks to pay oﬀ. You\nhave to survive to succeed. To repeat a point we’ve made a\nfew times in this book: The ability to do what you want,\nwhen you want, for as long as you want, has an inﬁnite ROI.\n\xa0\n\xa0\nRoom for error does more than just widen the target around\nwhat you think might happen. It also helps protect you from\nthings you’d never imagine, which can be the most\ntroublesome events we face.', 'After spending years around investors and business leaders\nI’ve come to realize that someone else’s failure is usually\nattributed to bad decisions, while your own failures are\nusually chalked up to the dark side of risk. When judging\nyour failures I’m likely to prefer a clean and simple story of\ncause and eﬀect, because I don’t know what’s going on\ninside your head. “You had a bad outcome so it must have\nbeen caused by a bad decision” is the story that makes the\nmost sense to me. But when judging myself I can make up a\nwild narrative justifying my past decisions and attributing\nbad outcomes to risk.\nThe cover of Forbes magazine does not celebrate poor\ninvestors who made good decisions but happened to\nexperience the unfortunate side of risk. But it almost\ncertainly celebrates rich investors who made OK or even\nreckless decisions and happened to get lucky. Both ﬂipped\nthe same coin that happened to land on a diﬀerent side.\nThe dangerous part of this is that we’re all trying to learn']",An idea in finance that seems innocent but has done incalculable damage is the notion that assets have one rational price in a world where investors have different goals and time horizons.,It’s the notion that assets have one rational price in a world where investors have diﬀerent goals and time horizons.,0.75,0.9366398106779861,
"According to psychologist Philip Tetlock, why do people turn to authoritative-sounding people for forecasts?","['People know this. I have not met an investor who genuinely\nthinks market forecasts as a whole are accurate or useful.\nBut there’s still tremendous demand for forecasts, in both\nthe media and from ﬁnancial advisors.\nWhy?\nPsychologist Philip Tetlock once wrote: “We need to believe\nwe live in a predictable, controllable world, so we turn to\nauthoritative-sounding people who promise to satisfy that\nneed.”\nSatisfying that need is a great way to put it. Wanting to\nbelieve we are in control is an emotional itch that needs to\nbe scratched, rather than an analytical problem to be\ncalculated and solved. The illusion of control is more\npersuasive than the reality of uncertainty. So we cling to\nstories about outcomes being in our control.\nPart of this has to do with confusing ﬁelds of precision with\nﬁelds of uncertainty.\nNASA’s New Horizons spacecraft passed by Pluto two years\nago. It was a three-billion mile trip that took nine and a half\nyears. According to NASA, the trip “took about one minute', 'where a range of potential outcomes are acceptable—is the\nsmart way to proceed.\nBut people underestimate the need for room for error in\nalmost everything they do that involves money. Stock\nanalysts give their clients price targets, not price ranges.\nEconomic forecasters predict things with precise ﬁgures;\nrarely broad probabilities. The pundit who speaks in\nunshakable certainties will gain a larger following than the\none who says “We can’t know for sure,” and speaks in\nprobabilities.⁴²\nWe do this in all kinds of ﬁnancial endeavors, especially\nthose related to our own decisions. Harvard psychologist\nMax Bazerman once showed that when analyzing other\npeople’s home renovation plans, most people estimate the\nproject will run between 25% and 50% over budget.⁴³ But\nwhen it comes to their own projects, people estimate that\nrenovations will be completed on time and at budget. Oh,\nthe eventual disappointment.\nTwo things cause us to avoid room for error. One is the idea', 'continue acting that way, what will make them change their\nmind, or whether they’ll ever learn their lesson.\nWhen a commentator on CNBC says, “You should buy this\nstock,” keep in mind that they do not know who you are. Are\nyou a teenager trading for fun? An elderly widow on a\nlimited budget? A hedge fund manager trying to shore up\nyour books before the quarter ends? Are we supposed to\nthink those three people have the same priorities, and that\nwhatever level a particular stock is trading at is right for all\nthree of them?\nIt’s crazy.\nIt’s hard to grasp that other investors have diﬀerent goals\nthan we do, because an anchor of psychology is not realizing\nthat rational people can see the world through a diﬀerent\nlens than your own. Rising prices persuade all investors in\nways the best marketers envy. They are a drug that can turn\nvalue-conscious investors into dewy-eyed optimists,', 'future holds.” It’s another to admit that you, yourself, don’t\nknow today what you will even want in the future. And the\ntruth is, few of us do. It’s hard to make enduring long-term\ndecisions when your view of what you’ll want in the future is\nlikely to shift.\nThe End of History Illusion is what psychologists call the\ntendency for people to be keenly aware of how much they’ve\nchanged in the past, but to underestimate how much their\npersonalities, desires, and goals are likely to change in the\nfuture. Harvard psychologist Daniel Gilbert once said:\n\xa0\nAt every stage of our lives we make decisions that will\nprofoundly inﬂuence the lives of the people we’re going to\nbecome, and then when we become those people, we’re not\nalways thrilled with the decisions we made. So young', 'explained why he also owns a smattering of individual\nstocks: “I’m not buying individual stocks because I think I’m\ngoing to generate alpha [outperformance]. I just love stocks\nand have ever since I was 20 years old. And it’s my money, I\nget to do whatever.” Quite reasonable.\nMost forecasts about where the economy and the stock\nmarket are heading next are terrible, but making forecasts is\nreasonable. It’s hard to wake up in the morning telling\nyourself you have no clue what the future holds, even if it’s\ntrue. Acting on investment forecasts is dangerous. But I get\nwhy people try to predict what will happen next year. It’s\nhuman nature. It’s reasonable.\nJack Bogle, the late founder of Vanguard, spent his career on\na crusade to promote low-cost passive index investing. Many\nthought it interesting that his son found a career as an\nactive, high-fee hedge fund and mutual fund manager.\nBogle—the man who said high-fee funds violate “the']","According to psychologist Philip Tetlock, people turn to authoritative-sounding people for forecasts because ""We need to believe we live in a predictable, controllable world, so we turn to authoritative-sounding people who promise to satisfy that need.""","Psychologist Philip Tetlock once wrote: ""We need to believe we live in a predictable, controllable world, so we turn to authoritative-sounding people who promise to satisfy that need.""",1.0,0.9979127001408005,
What is the lesson for entrepreneurs mentioned in the text regarding the examples of Mark Zuckerberg and Yahoo!?,"['We similarly think Mark Zuckerberg is a genius for turning\ndown Yahoo!’s 2006 $1 billion oﬀer to buy his company. He\nsaw the future and stuck to his guns. But people criticize\nYahoo! with as much passion for turning down its own big\nbuyout oﬀer from Microsoft—those fools should have cashed\nout while they could! What is the lesson for entrepreneurs\nhere? I have no idea, because risk and luck are so hard to\npin down.\nThere are so many examples of this.\nCountless fortunes (and failures) owe their outcome to\nleverage.\nThe best (and worst) managers drive their employees as\nhard as they can.\n“The customer is always right” and “customers don’t know\nwhat they want” are both accepted business wisdom.\nThe line between “inspiringly bold” and “foolishly reckless”\ncan be a millimeter thick and only visible with hindsight.\nRisk and luck are doppelgangers.\nThis is not an easy problem to solve. The diﬃculty in\nidentifying what is luck, what is skill, and what is risk is one', 'Even when they are not sure they will succeed, these bold\npeople think their fate is almost entirely in their own hands.\nThey are surely wrong: the outcome of a start-up depends as\nmuch on the achievements of its competitors and on\nchanges in the market as on its own eﬀorts. However,\nentrepreneurs naturally focus on what they know best—their\nplans and actions and the most immediate threats and\nopportunities, such as the availability of funding. They know\nless about their competitors and therefore ﬁnd it natural to\nimagine a future in which the competition plays little part.\n\xa0\nWe all do this to some extent.\nAnd like my daughter, it doesn’t bother us a bit.\nWe don’t wander around blind and confused. We have to\nthink the world we operate in makes sense based on what\nwe happen to know. It’d be too hard to get out of bed in the\nmorning if you felt otherwise.\nBut the alien circling over Earth?\nThe one who’s conﬁdent he knows what’s happening based\non what he sees but turns out to be completely wrong', 'Graham died in 1976. If the formulas he advocated were\ndiscarded and updated ﬁve times between 1934 and 1972,\nhow relevant do you think they are in 2020? Or will be in\n2050?\nJust before he died Graham was asked whether detailed\nanalysis of individual stocks—a tactic he became famous for\n—remained a strategy he favored. He answered:\n\xa0\nIn general, no. I am no longer an advocate of elaborate\ntechniques of security analysis in order to ﬁnd superior value\nopportunities. This was a rewarding activity, say, 40 years\nago, when our textbook was ﬁrst published. But the\nsituation has changed a great deal since then.⁴¹\n\xa0\nWhat changed was: Competition grew as opportunities\nbecame well known; technology made information more\naccessible; and industries changed as the economy shifted\nfrom industrial to technology sectors, which have diﬀerent\nbusiness cycles and capital uses.\nThings changed.\nAn interesting quirk of investing history is that the further\nback you look, the more likely you are to be examining a', 'done well implementing Graham’s published formulas. The\nbook is full of wisdom—perhaps more than any other\ninvestment book ever published. But as a how-to guide, it’s\nquestionable at best.\nWhat happened? Was Graham a showman who sounded\ngood but whose advice didn’t work? Not at all. He was a\nwildly successful investor himself.\nBut he was practical. And he was a true contrarian. He\nwasn’t so wedded to investing ideas that he’d stick with\nthem when too many other investors caught onto those\ntheories, making them so popular as to render their\npotential useless. Jason Zweig—who annotated a later\nversion of Graham’s book—once wrote:\n\xa0\nGraham was constantly experimenting and retesting his\nassumptions and seeking out what works—not what worked\nyesterday but what works today. In each revised edition of\nThe Intelligent Investor, Graham discarded the formulas he\npresented in the previous edition and replaced them with\nnew ones, declaring, in a sense, that “those do not work', 'History is littered with good ideas taken too far, which are\nindistinguishable from bad ideas. The wisdom in having\nroom for error is acknowledging that uncertainty,\nrandomness, and chance—“unknowns”—are an ever-present\npart of life. The only way to deal with them is by increasing\nthe gap between what you think will happen and what can\nhappen while still leaving you capable of ﬁghting another\nday.\n\xa0\n\xa0\nBenjamin Graham is known for his concept of margin of\nsafety. He wrote about it extensively and in mathematical\ndetail. But my favorite summary of the theory came when he\nmentioned in an interview that “the purpose of the margin\nof safety is to render the forecast unnecessary.”\nIt’s hard to overstate how much power lies in that simple\nstatement.\nMargin of safety—you can also call it room for error or\nredundancy—is the only eﬀective way to safely navigate a\nworld that is governed by odds, not certainties. And almost\neverything related to money exists in that kind of world.']","The text states that regarding the examples of Mark Zuckerberg and Yahoo!, there is no clear lesson for entrepreneurs because risk and luck are so hard to pin down.","I have no idea, because risk and luck are so hard to pin down.",1.0,0.9357333876627913,
What is the one way to guard against the damage caused by unknown risks?,"['A company was kicked out of its manufacturing plant.\n\xa0\nA store was shut down after a customer called the health\ndepartment because she didn’t like that another customer\nbrought a dog inside.\n\xa0\nA CEO’s email was spoofed in the middle of a fundraise that\nrequired all of his attention.\n\xa0\nA founder had a mental breakdown.\n\xa0\nSeveral of these events were existential to the company’s\nfuture. But none were foreseeable, because none had\npreviously happened to the CEOs dealing with these\nproblems—or anyone else they knew, for that matter. It was\nunchartered territory.\nAvoiding these kinds of unknown risks is, almost by\ndeﬁnition, impossible. You can’t prepare for what you can’t\nenvision.\nIf there’s one way to guard against their damage, it’s\navoiding single points of failure.\nA good rule of thumb for a lot of things in life is that\neverything that can break will eventually break. So if many\nthings rely on one thing working, and that thing breaks, you', 'reckless decisions and happened to get lucky. Both ﬂipped\nthe same coin that happened to land on a diﬀerent side.\nThe dangerous part of this is that we’re all trying to learn\nabout what works and what doesn’t with money.\nWhat investing strategies work? Which ones don’t?\nWhat business strategies work? Which ones don’t?\nHow do you get rich? How do you avoid being poor?\nWe tend to seek out these lessons by observing successes\nand failures and saying, “Do what she did, avoid what he\ndid.”\nIf we had a magic wand we would ﬁnd out exactly what\nproportion of these outcomes were caused by actions that\nare repeatable, versus the role of random risk and luck that\nswayed those actions one way or the other. But we don’t\nhave a magic wand. We have brains that prefer easy', 'History is littered with good ideas taken too far, which are\nindistinguishable from bad ideas. The wisdom in having\nroom for error is acknowledging that uncertainty,\nrandomness, and chance—“unknowns”—are an ever-present\npart of life. The only way to deal with them is by increasing\nthe gap between what you think will happen and what can\nhappen while still leaving you capable of ﬁghting another\nday.\n\xa0\n\xa0\nBenjamin Graham is known for his concept of margin of\nsafety. He wrote about it extensively and in mathematical\ndetail. But my favorite summary of the theory came when he\nmentioned in an interview that “the purpose of the margin\nof safety is to render the forecast unnecessary.”\nIt’s hard to overstate how much power lies in that simple\nstatement.\nMargin of safety—you can also call it room for error or\nredundancy—is the only eﬀective way to safely navigate a\nworld that is governed by odds, not certainties. And almost\neverything related to money exists in that kind of world.', 'After spending years around investors and business leaders\nI’ve come to realize that someone else’s failure is usually\nattributed to bad decisions, while your own failures are\nusually chalked up to the dark side of risk. When judging\nyour failures I’m likely to prefer a clean and simple story of\ncause and eﬀect, because I don’t know what’s going on\ninside your head. “You had a bad outcome so it must have\nbeen caused by a bad decision” is the story that makes the\nmost sense to me. But when judging myself I can make up a\nwild narrative justifying my past decisions and attributing\nbad outcomes to risk.\nThe cover of Forbes magazine does not celebrate poor\ninvestors who made good decisions but happened to\nexperience the unfortunate side of risk. But it almost\ncertainly celebrates rich investors who made OK or even\nreckless decisions and happened to get lucky. Both ﬂipped\nthe same coin that happened to land on a diﬀerent side.\nThe dangerous part of this is that we’re all trying to learn', 'and the more extreme your past decisions were the\nmore you may regret them as you evolve.\nYou should like risk because it pays oﬀ over time. But\nyou should be paranoid of ruinous risk because it\nprevents you from taking future risks that will pay\noﬀ over time.\nDeﬁne the game you’re playing, and make sure your\nactions are not being inﬂuenced by people playing a\ndiﬀerent game.\nRespect the mess. Smart, informed, and reasonable\npeople can disagree in ﬁnance, because people have\nvastly diﬀerent goals and desires. There is no single\nright answer; just the answer that works for you.\nNow let me tell you what works for me.']","If there's one way to guard against the damage caused by unknown risks, it's avoiding single points of failure.","If there’s one way to guard against their damage, it’s avoiding single points of failure.",,0.9981543967869367,
Has trial and error taught us to become better with our personal finances?,"['I have seen none.\nThrough collective trial and error over the years we learned how to become better farmers,skilled plumbers, and advanced chemists. But has trial and error taught us to becomebetter with our personal ﬁnances? Are we less likely to bury ourselves in debt? More likelyto save for a rainy day? Prepare for retirement? Have realistic views about what moneydoes, and doesn’t do, to our happiness?\nI’ve seen no compelling evidence.\nMost of the reason why, I believe, is that we think about and are taught about money inways that are too much like physics (with rules and laws) and not enough like psychology(with emotions and nuance).\nAnd that, to me, is as fascinating as it is important.', 'I call this soft skill the psychology of money. The aim of this book is to use short stories toconvince you that soft skills are more important than the technical side of money. I’ll do thisin a way that will help everyone—from Read to Fuscone and everyone in between—makebetter ﬁnancial decisions.\nThese soft skills are, I’ve come to realize, greatly underappreciated.\nFinance is overwhelmingly taught as a math-based ﬁeld, where you put data into a formulaand the formula tells you what to do, and it’s assumed that you’ll just go do it.\nThis is true in personal ﬁnance, where you’re told to have a six-month emergency fund andsave 10% of your salary.\nIt’s true in investing, where we know the exact historical correlations between interest ratesand valuations.\nAnd it’s true in corporate ﬁnance, where CFOs can measure the precise cost of capital.', 'people pay good money to get tattoos removed that\nteenagers paid good money to get. Middle-aged people\nrushed to divorce people who young adults rushed to marry.\nOlder adults work hard to lose what middle-aged adults\nworked hard to gain. On and on and on.⁴⁸\n\xa0\n“All of us,” he said, “are walking around with an illusion—an\nillusion that history, our personal history, has just come to\nan end, that we have just recently become the people that\nwe were always meant to be and will be for the rest of our\nlives.” We tend to never learn this lesson. Gilbert’s research\nshows people from age 18 to 68 underestimate how much\nthey will change in the future.\nYou can see how this can impact a long-term ﬁnancial plan.\nCharlie Munger says the ﬁrst rule of compounding is to\nnever interrupt it unnecessarily. But how do you not\ninterrupt a money plan—careers, investments, spending,\nbudgeting, whatever—when what you want out of life\nchanges? It’s hard. Part of the reason people like Ronald', 'interrupt a money plan—careers, investments, spending,\nbudgeting, whatever—when what you want out of life\nchanges? It’s hard. Part of the reason people like Ronald\nRead—the wealthy janitor we met earlier in the book—and\nWarren Buﬀett become so successful is because they kept\ndoing the same thing for decades on end, letting\ncompounding run wild. But many of us evolve so much over\na lifetime that we don’t want to keep doing the same thing\nfor decades on end. Or anything close to it. So rather than\none 80-something-year lifespan, our money has perhaps\nfour distinct 20-year blocks.\nI know young people who purposefully live austere lives with\nlittle income, and they’re perfectly happy with it. Then there\nare those who work their tails oﬀ to pay for a life of luxury,\nand they’re perfectly happy with that. Both have risks—the\nformer risks being unprepared to raise a family or fund', 'You know stuﬀ about money that I don’t, and vice versa. You go\nthrough life with diﬀerent beliefs, goals, and forecasts, than I\ndo. That’s not because one of us is smarter than the other, or\nhas better information. It’s because we’ve had diﬀerent lives\nshaped by diﬀerent and equally persuasive experiences.\nYour personal experiences with money make up maybe\n0.00000001% of what’s happened in the world, but maybe\n80% of how you think the world works. So equally smart\npeople can disagree about how and why recessions happen,\nhow you should invest your money, what you should prioritize,\nhow much risk you should take, and so on.\nIn his book on 1930s America, Frederick Lewis Allen wrote that\nthe Great Depression “marked millions of Americans—inwardly\n—for the rest of their lives.” But there was a range of\nexperiences. Twenty-ﬁve years later, as he was running for\npresident, John F. Kennedy was asked by a reporter what he\nremembered from the Depression. He remarked:']","No, the author has seen no compelling evidence that trial and error has taught us to become better with our personal finances.",I’ve seen no compelling evidence.,1.0,0.8854132460276313,
What would James Simons be worth if he had earned 66% annual returns for the 70-year span Buffett has built his wealth?,"['the longevity he maintained in his geriatric years.\nHis skill is investing, but his secret is time.\nThat’s how compounding works.\nThink of this another way. Buﬀett is the richest investor of all\ntime. But he’s not actually the greatest—at least not when\nmeasured by average annual returns.\nJim Simons, head of the hedge fund Renaissance\nTechnologies, has compounded money at 66% annually\nsince 1988. No one comes close to this record. As we just\nsaw, Buﬀett has compounded at roughly 22% annually, a\nthird as much.\nSimons’ net worth, as I write, is $21 billion. He is—and I\nknow how ridiculous this sounds given the numbers we’re\ndealing with—75% less rich than Buﬀett.\nWhy the diﬀerence, if Simons is such a better investor?\nBecause Simons did not ﬁnd his investment stride until he\nwas 50 years old. He’s had less than half as many years to\ncompound as Buﬀett. If James Simons had earned his 66%\nannual returns for the 70-year span Buﬀett has built his\nwealth he would be worth—please hold your breath—sixty-', 'compound as Buﬀett. If James Simons had earned his 66%\nannual returns for the 70-year span Buﬀett has built his\nwealth he would be worth—please hold your breath—sixty-\nthree quintillion nine hundred quadrillion seven hundred\neighty-one trillion seven hundred eighty billion seven\nhundred forty-eight million one hundred sixty thousand\ndollars.\nThese are ridiculous, impractical numbers. The point is that\nwhat seem like small changes in growth assumptions can\nlead to ridiculous, impractical numbers. And so when we are\nstudying why something got to become as powerful as it has\n—why an ice age formed, or why Warren Buﬀett is so rich—\nwe often overlook the key drivers of success.', 'age 30 his net worth was, say, $25,000?\nAnd let’s say he still went on to earn the extraordinary\nannual investment returns he’s been able to generate (22%\nannually), but quit investing and retired at age 60 to play\ngolf and spend time with his grandkids.\nWhat would a rough estimate of his net worth be today?\nNot $84.5 billion.\n$11.9 million.\n99.9% less than his actual net worth.\nEﬀectively all of Warren Buﬀett’s ﬁnancial success can be\ntied to the ﬁnancial base he built in his pubescent years and', 'As I write this Warren Buﬀett’s net worth is $84.5 billion. Of\nthat, $84.2 billion was accumulated after his 50th birthday.\n$81.5 billion came after he qualiﬁed for Social Security, in\nhis mid-60s.\nWarren Buﬀett is a phenomenal investor. But you miss a key\npoint if you attach all of his success to investing acumen.\nThe real key to his success is that he’s been a phenomenal\ninvestor for three quarters of a century. Had he started\ninvesting in his 30s and retired in his 60s, few people would\nhave ever heard of him.\nConsider a little thought experiment.\nBuﬀett began serious investing when he was 10 years old.\nBy the time he was 30 he had a net worth of $1 million, or\n$9.3 million adjusted for inﬂation.¹⁶\nWhat if he was a more normal person, spending his teens\nand 20s exploring the world and ﬁnding his passion, and by\nage 30 his net worth was, say, $25,000?\nAnd let’s say he still went on to earn the extraordinary\nannual investment returns he’s been able to generate (22%', 'What he went on to achieve from those beginnings was\nsimply phenomenal.\nBy his mid 40s Gupta was CEO of McKinsey, the world’s\nmost prestigious consulting ﬁrm. He retired in 2007 to take\non roles with the United Nations and the World Economic\nForum. He partnered on philanthropic work with Bill Gates.\nHe sat on the board of directors of ﬁve public companies.\nFrom the slums of Kolkata, Gupta had quite literally become\none of the most successful businessmen alive.\nWith his success came enormous wealth. By 2008 Gupta\nwas reportedly worth $100 million.¹¹ It’s an unfathomable\nsum of money to most. A ﬁve percent annual return on that\nmuch money generates almost $600 an hour, 24 hours a\nday.\nHe could have done anything he wanted in life.\nAnd what he wanted, by all accounts, wasn’t to be a mere\ncenta-millionaire. Rajat Gupta wanted to be a billionaire.\nAnd he wanted it badly.\nGupta sat on the board of directors of Goldman Sachs,\nwhich surrounded him with some of the wealthiest investors']","If James Simons had earned his 66% annual returns for the 70-year span Buffett has built his wealth, he would be worth sixty-three quintillion nine hundred quadrillion seven hundred eighty-one trillion seven hundred eighty billion seven hundred forty-eight million one hundred sixty thousand dollars.",sixty-three quintillion nine hundred quadrillion seven hundred eighty-one trillion seven hundred eighty billion seven hundred forty-eight million one hundred sixty thousand dollars.,1.0,0.9637253634362878,
What are the two explanations for Ronald Read coexisting with Richard Fuscone?,"['bankruptcy judge in 2008.\nFirst his Palm Beach house was foreclosed.\nIn 2014 it was the Greenwich mansion’s turn.\nFive months before Ronald Read left his fortune to charity, Richard Fuscone’s home—whereguests recalled the “thrill of dining and dancing atop a see-through covering on the home’sindoor swimming pool”—was sold in a foreclosure auction for 75% less than an insurancecompany ﬁgured it was worth.³\nRonald Read was patient; Richard Fuscone was greedy. That’s all it took to eclipse themassive education and experience gap between the two.\nThe lesson here is not to be more like Ronald and less like Richard—though that’s not badadvice.\nThe fascinating thing about these stories is how unique they are to ﬁnance.\nIn what other industry does someone with no college degree, no training, no background,no formal experience, and no connections massively outperform someone with the besteducation, the best training, and the best connections?\nI struggle to think of any.', 'That’s it. From janitor to philanthropist.\nA few months before Ronald Read died, another man named Richard was in the news.\nRichard Fuscone was everything Ronald Read was not. A Harvard-educated Merrill Lynchexecutive with an MBA, Fuscone had such a successful career in ﬁnance that he retired inhis 40s to become a philanthropist. Former Merrill CEO David Komansky praised Fuscone’s“business savvy, leadership skills, sound judgment and personal integrity.”¹ Crain’sbusiness magazine once included him in a “40 under 40” list of successful businesspeople.²\nBut then—like the gold-coin-skipping tech executive—everything fell apart.\nIn the mid-2000s Fuscone borrowed heavily to expand an 18,000-square foot home inGreenwich, Connecticut that had 11 bathrooms, two elevators, two pools, seven garages,and cost more than $90,000 a month to maintain.\nThen the 2008 ﬁnancial crisis hit.', 'Read died in 2014, age 92. Which is when the humble rural janitor made internationalheadlines.\n2,813,503 Americans died in 2014. Fewer than 4,000 of them had a net worth of over $8million when they passed away. Ronald Read was one of them.\nIn his will the former janitor left $2 million to his stepkids and more than $6 million to hislocal hospital and library.\nThose who knew Read were baﬄed. Where did he get all that money?\nIt turned out there was no secret. There was no lottery win and no inheritance. Read savedwhat little he could and invested it in blue chip stocks. Then he waited, for decades on end,as tiny savings compounded into more than $8 million.\nThat’s it. From janitor to philanthropist.\nA few months before Ronald Read died, another man named Richard was in the news.', 'A genius who loses control of their emotions can be a ﬁnancial disaster. The opposite is alsotrue. Ordinary folks with no ﬁnancial education can be wealthy if they have a handful ofbehavioral skills that have nothing to do with formal measures of intelligence.\n\xa0\xa0\nMy favorite Wikipedia entry begins: “Ronald James Read was an American philanthropist,investor, janitor, and gas station attendant.”\nRonald Read was born in rural Vermont. He was the ﬁrst person in his family to graduatehigh school, made all the more impressive by the fact that he hitchhiked to campus eachday.\nFor those who knew Ronald Read, there wasn’t much else worth mentioning. His life wasabout as low key as they come.\nRead ﬁxed cars at a gas station for 25 years and swept ﬂoors at JCPenney for 17 years. Hebought a two-bedroom house for $12,000 at age 38 and lived there for the rest of his life.He was widowed at age 50 and never remarried. A friend recalled that his main hobby waschopping ﬁrewood.', 'I struggle to think of any.\nIt is impossible to think of a story about Ronald Read performing a heart transplant betterthan a Harvard-trained surgeon. Or designing a skyscraper superior to the best-trainedarchitects. There will never be a story of a janitor outperforming the world’s top nuclearengineers.\nBut these stories do happen in investing.\nThe fact that Ronald Read can coexist with Richard Fuscone has two explanations. One,ﬁnancial outcomes are driven by luck, independent of intelligence and eﬀort. That’s true tosome extent, and this book will discuss it in further detail. Or, two (and I think morecommon), that ﬁnancial success is not a hard science. It’s a soft skill, where how youbehave is more important than what you know.']","The two explanations for Ronald Read coexisting with Richard Fuscone are:

1.  Financial outcomes are driven by luck, independent of intelligence and effort.
2.  Financial success is not a hard science; it's a soft skill where how you behave is more important than what you know.","One, financial outcomes are driven by luck, independent of intelligence and effort. That’s true to some extent, and this book will discuss it in further detail. Or, two (and I think more common), that financial success is not a hard science. It’s a soft skill, where how you behave is more important than what you know.",,0.9999999999999994,
